{
  "$schema": "../../schemas/production.schema.json",
  "schemaVersion": 1,
  "slug": "last-red-leaf",
  "stage": "human-review",
  "createdAt": "2026-07-21T15:35:31.465Z",
  "updatedAt": "2026-07-21T17:20:50.709Z",
  "approvals": {
    "concept": {
      "status": "approved",
      "decidedAt": "2026-07-21T15:49:24.180Z",
      "note": "用户批准《最后一片红叶》约 28 秒、两幕故事与画面方向，批准 full-depth 档位及最多 9 次生图尝试，批准当前 Codex 文本、GPT Image 图像、ChatCut 豆包 TTS 服务方案，并明确选择虚构音色‘儒雅逸辰’（ruyayichen）继续。"
    },
    "styleAndVoice": {
      "status": "approved",
      "decidedAt": "2026-07-21T16:37:11.956Z",
      "note": "用户明确批准当前纸拼贴风格、v4 运动拓扑证明与虚构音色‘儒雅逸辰’（ruyayichen），并要求继续 full-depth 制作。"
    },
    "preview": {
      "status": "pending",
      "decidedAt": null,
      "note": ""
    },
    "publish": {
      "status": "pending",
      "decidedAt": null,
      "note": ""
    }
  },
  "workItems": [],
  "artifacts": {
    "brief": "projects/last-red-leaf/brief.md",
    "project": "projects/last-red-leaf/project.json",
    "storyboard": "projects/last-red-leaf/storyboard.json",
    "prompts": "projects/last-red-leaf/prompts.json",
    "review": "projects/last-red-leaf/review.md",
    "validationReport": "dist/last-red-leaf/validation-report.json",
    "preview": "dist/last-red-leaf/preview.mp4",
    "final": null,
    "report": "dist/last-red-leaf/report.json",
    "contactSheet": "dist/last-red-leaf/contact-sheet.jpg",
    "styleProof": "dist/last-red-leaf/style-motion-proof.json"
  },
  "history": [
    {
      "at": "2026-07-21T15:35:31.465Z",
      "action": "project-created",
      "stage": "capability-review",
      "note": ""
    },
    {
      "at": "2026-07-21T15:49:24.180Z",
      "action": "capabilities-ready",
      "stage": "brief",
      "note": "用户批准《最后一片红叶》约 28 秒、两幕故事与画面方向，批准 full-depth 档位及最多 9 次生图尝试，批准当前 Codex 文本、GPT Image 图像、ChatCut 豆包 TTS 服务方案，并明确选择虚构音色‘儒雅逸辰’（ruyayichen）继续。"
    },
    {
      "at": "2026-07-21T15:49:24.180Z",
      "action": "brief-ready",
      "stage": "concept-review",
      "note": ""
    },
    {
      "at": "2026-07-21T15:49:24.180Z",
      "action": "approve-concept",
      "stage": "style-review",
      "note": "用户批准《最后一片红叶》约 28 秒、两幕故事与画面方向，批准 full-depth 档位及最多 9 次生图尝试，批准当前 Codex 文本、GPT Image 图像、ChatCut 豆包 TTS 服务方案，并明确选择虚构音色‘儒雅逸辰’（ruyayichen）继续。"
    },
    {
      "at": "2026-07-21T16:37:11.956Z",
      "action": "approve-style-voice",
      "stage": "asset-production",
      "note": "用户明确批准当前纸拼贴风格、v4 运动拓扑证明与虚构音色‘儒雅逸辰’（ruyayichen），并要求继续 full-depth 制作。"
    },
    {
      "at": "2026-07-21T17:12:57.798Z",
      "action": "assets-ready",
      "stage": "preview",
      "note": ""
    },
    {
      "at": "2026-07-21T17:20:50.709Z",
      "action": "preview-rendered",
      "stage": "human-review",
      "note": "dist/last-red-leaf/preview.mp4"
    }
  ]
}
