{
  "$schema": "../../schemas/production.schema.json",
  "schemaVersion": 1,
  "slug": "{{slug}}",
  "stage": "capability-review",
  "createdAt": "{{createdAt}}",
  "updatedAt": "{{createdAt}}",
  "approvals": {
    "concept": {"status": "pending", "decidedAt": null, "note": ""},
    "styleAndVoice": {"status": "pending", "decidedAt": null, "note": ""},
    "preview": {"status": "pending", "decidedAt": null, "note": ""},
    "publish": {"status": "pending", "decidedAt": null, "note": ""}
  },
  "workItems": [],
  "artifacts": {
    "brief": "projects/{{slug}}/brief.md",
    "project": "projects/{{slug}}/project.json",
    "storyboard": "projects/{{slug}}/storyboard.json",
    "prompts": "projects/{{slug}}/prompts.json",
    "review": "projects/{{slug}}/review.md",
    "validationReport": null,
    "assetsReadySeal": null,
    "preview": null,
    "final": null,
    "report": null,
    "contactSheet": null
  },
  "history": [
    {
      "at": "{{createdAt}}",
      "action": "project-created",
      "stage": "capability-review",
      "note": ""
    }
  ]
}
