{
  "$schema": "../../schemas/production.schema.json",
  "schemaVersion": 1,
  "slug": "vox-depth-stack-pilot-submarine-cinematic",
  "stage": "complete",
  "createdAt": "2026-07-23T19:36:27.143Z",
  "updatedAt": "2026-07-24T00:29:36.189Z",
  "approvals": {
    "concept": {
      "status": "approved",
      "decidedAt": "2026-07-23T19:41:21.809Z",
      "note": "用户要求再生成一个更长的《黄色潜艇穿过海草》单幕视频，并授权对当前素材自由发挥；采用内容推导 18 秒、full-depth、多段焦距式推拉、潜艇反向运动与尺度变化、前后景鱼群及气泡。全部使用当前已审核素材，不追加 provider 调用；图片尝试上限 1 仅覆盖 registered source-package 的契约容量，实际计划调用为 0。"
    },
    "styleAndVoice": {
      "status": "approved",
      "decidedAt": "2026-07-23T20:02:32.809Z",
      "note": "用户授权沿用当前素材并自由发挥；v6 style/motion proof 与 1536 registered depth stack 全量证据通过，音乐沿用本地确定性衍生版本。"
    },
    "preview": {
      "status": "approved",
      "decidedAt": "2026-07-24T00:23:47.660Z",
      "note": "按用户既有授权完成 human-review：完整 18 秒 preview 技术报告全部通过；逐帧联系表与每秒抽帧确认潜艇相对背景完成左下入场、向右上大跨度穿越及中右部锁定，水草围绕底部轴心左右摆动，气泡从下向上运动，前后景鱼群与相机视差保持清楚层级。"
    },
    "publish": {
      "status": "approved",
      "decidedAt": "2026-07-24T00:29:36.189Z",
      "note": "按用户既有最终渲染审批授权记录本地成片批准：final.mp4 为 1920×1080、30fps、18.048 秒，音视频与成片报告全部通过；最终联系表复核潜艇世界内大航迹、水草摆动、物理上升气泡、前后景鱼群及相机视差均保持。仅批准本地最终成片，不执行外部发布。"
    }
  },
  "workItems": [
    {
      "id": "directing-revision-submarine-scene",
      "label": "同步导演重编镜头 submarine-scene",
      "status": "completed",
      "updatedAt": "2026-07-24T00:15:44.657Z",
      "artifact": "projects/vox-depth-stack-pilot-submarine-cinematic/directing-revision.json",
      "note": "已按 registered-depth-stack 主体航迹、水草底部轴心摆动与 rise-drift 气泡同步 project.json；18 秒项目验证 0 error / 0 warning，style/motion proof 已重渲染并逐帧检查。"
    }
  ],
  "artifacts": {
    "brief": "projects/vox-depth-stack-pilot-submarine-cinematic/brief.md",
    "project": "projects/vox-depth-stack-pilot-submarine-cinematic/project.json",
    "storyboard": "projects/vox-depth-stack-pilot-submarine-cinematic/storyboard.json",
    "prompts": "projects/vox-depth-stack-pilot-submarine-cinematic/prompts.json",
    "review": "projects/vox-depth-stack-pilot-submarine-cinematic/review.md",
    "validationReport": "dist/vox-depth-stack-pilot-submarine-cinematic/validation-report.json",
    "preview": "dist/vox-depth-stack-pilot-submarine-cinematic/preview.mp4",
    "final": "dist/vox-depth-stack-pilot-submarine-cinematic/final.mp4",
    "report": "dist/vox-depth-stack-pilot-submarine-cinematic/report.json",
    "contactSheet": "dist/vox-depth-stack-pilot-submarine-cinematic/contact-sheet.jpg",
    "styleProof": null,
    "directingRevision": "projects/vox-depth-stack-pilot-submarine-cinematic/directing-revision.json"
  },
  "history": [
    {
      "at": "2026-07-23T19:36:27.143Z",
      "action": "project-created",
      "stage": "capability-review",
      "note": ""
    },
    {
      "at": "2026-07-23T19:41:21.809Z",
      "action": "capabilities-ready",
      "stage": "brief",
      "note": "用户要求再生成一个更长的《黄色潜艇穿过海草》单幕视频，并授权对当前素材自由发挥；采用内容推导 18 秒、full-depth、多段焦距式推拉、潜艇反向运动与尺度变化、前后景鱼群及气泡。全部使用当前已审核素材，不追加 provider 调用；图片尝试上限 1 仅覆盖 registered source-package 的契约容量，实际计划调用为 0。"
    },
    {
      "at": "2026-07-23T19:41:21.809Z",
      "action": "brief-ready",
      "stage": "concept-review",
      "note": ""
    },
    {
      "at": "2026-07-23T19:41:21.809Z",
      "action": "approve-concept",
      "stage": "style-review",
      "note": "用户要求再生成一个更长的《黄色潜艇穿过海草》单幕视频，并授权对当前素材自由发挥；采用内容推导 18 秒、full-depth、多段焦距式推拉、潜艇反向运动与尺度变化、前后景鱼群及气泡。全部使用当前已审核素材，不追加 provider 调用；图片尝试上限 1 仅覆盖 registered source-package 的契约容量，实际计划调用为 0。"
    },
    {
      "at": "2026-07-23T20:02:32.809Z",
      "action": "approve-style-voice",
      "stage": "asset-production",
      "note": "用户授权沿用当前素材并自由发挥；v6 style/motion proof 与 1536 registered depth stack 全量证据通过，音乐沿用本地确定性衍生版本。"
    },
    {
      "at": "2026-07-23T20:10:35.093Z",
      "action": "assets-ready",
      "stage": "preview",
      "note": ""
    },
    {
      "at": "2026-07-23T20:12:12.588Z",
      "action": "preview-rendered",
      "stage": "human-review",
      "note": "dist/vox-depth-stack-pilot-submarine-cinematic/preview.mp4"
    },
    {
      "at": "2026-07-23T20:12:44.132Z",
      "action": "approve-preview",
      "stage": "final-render",
      "note": "依据用户此前明确授权在 preview 完成并通过后代为通过 human-review；已检查完整 preview、六格联系表和验收报告，18 秒多焦距、潜艇折返/尺度变化、前后景鱼群、气泡、水草和三层视差符合本次要求。"
    },
    {
      "at": "2026-07-23T20:17:29.135Z",
      "action": "final-rendered",
      "stage": "complete",
      "note": "dist/vox-depth-stack-pilot-submarine-cinematic/final.mp4"
    },
    {
      "at": "2026-07-23T23:58:03.626Z",
      "action": "request-preview-revision",
      "stage": "asset-production",
      "note": "用户要求主体、水草、鱼群与气泡建立真实世界内相对运动，替换相机主导的旧预览"
    },
    {
      "at": "2026-07-23T23:58:03.835Z",
      "action": "revise-preview-directing",
      "stage": "asset-production",
      "note": "submarine-scene · projects/vox-depth-stack-pilot-submarine-cinematic/directing-revision.json"
    },
    {
      "at": "2026-07-24T00:04:13.355Z",
      "action": "work-item-completed",
      "stage": "asset-production",
      "note": "directing-revision-submarine-scene · 执行树已同步并通过540帧项目验证"
    },
    {
      "at": "2026-07-24T00:07:19.843Z",
      "action": "revise-preview-directing",
      "stage": "asset-production",
      "note": "submarine-scene · projects/vox-depth-stack-pilot-submarine-cinematic/directing-revision.json"
    },
    {
      "at": "2026-07-24T00:15:44.657Z",
      "action": "work-item-completed",
      "stage": "asset-production",
      "note": "directing-revision-submarine-scene · 已按 registered-depth-stack 主体航迹、水草底部轴心摆动与 rise-drift 气泡同步 project.json；18 秒项目验证 0 error / 0 warning，style/motion proof 已重渲染并逐帧检查。"
    },
    {
      "at": "2026-07-24T00:21:18.049Z",
      "action": "assets-ready",
      "stage": "preview",
      "note": ""
    },
    {
      "at": "2026-07-24T00:22:52.893Z",
      "action": "preview-rendered",
      "stage": "human-review",
      "note": "dist/vox-depth-stack-pilot-submarine-cinematic/preview.mp4"
    },
    {
      "at": "2026-07-24T00:23:47.660Z",
      "action": "approve-preview",
      "stage": "final-render",
      "note": "按用户既有授权完成 human-review：完整 18 秒 preview 技术报告全部通过；逐帧联系表与每秒抽帧确认潜艇相对背景完成左下入场、向右上大跨度穿越及中右部锁定，水草围绕底部轴心左右摆动，气泡从下向上运动，前后景鱼群与相机视差保持清楚层级。"
    },
    {
      "at": "2026-07-24T00:29:04.002Z",
      "action": "final-rendered",
      "stage": "complete",
      "note": "dist/vox-depth-stack-pilot-submarine-cinematic/final.mp4"
    },
    {
      "at": "2026-07-24T00:29:36.189Z",
      "action": "approve-publish",
      "stage": "complete",
      "note": "按用户既有最终渲染审批授权记录本地成片批准：final.mp4 为 1920×1080、30fps、18.048 秒，音视频与成片报告全部通过；最终联系表复核潜艇世界内大航迹、水草摆动、物理上升气泡、前后景鱼群及相机视差均保持。仅批准本地最终成片，不执行外部发布。"
    }
  ]
}
