{
  "$schema": "../../schemas/production.schema.json",
  "schemaVersion": 1,
  "slug": "zhuang-zhou-meng-die",
  "stage": "complete",
  "createdAt": "2026-07-22T12:14:43.322Z",
  "updatedAt": "2026-07-22T16:22:56.100Z",
  "approvals": {
    "concept": {
      "status": "approved",
      "decidedAt": "2026-07-22T12:23:42.244Z",
      "note": "用户明确批准《庄周梦蝶》现有事实口径、五幕故事板与内容推导的 75 秒时长；选择 balanced 制作档位，授权当前 Codex host model 编写文本、当前 Codex 图像生成工具制作图片，并选择 Doubao seed-tts-2.0 的虚构音色‘儒雅逸辰（ruyayichen）’制作中文旁白。"
    },
    "styleAndVoice": {
      "status": "approved",
      "decidedAt": "2026-07-22T13:21:18.133Z",
      "note": "用户明确确认修订版通过：传统宣纸蝴蝶风格、四态一次性扇翅后稳定悬停、圆环仅淡入不缩放，以及儒雅逸辰音色均获批准。"
    },
    "preview": {
      "status": "approved",
      "decidedAt": "2026-07-22T16:19:25.359Z",
      "note": "用户明确回复“样片通过”，批准当前修订样片进入最终本地成片渲染；不包含上传、分享或外部发布授权。"
    },
    "publish": {
      "status": "pending",
      "decidedAt": null,
      "note": ""
    }
  },
  "workItems": [],
  "artifacts": {
    "brief": "projects/zhuang-zhou-meng-die/brief.md",
    "project": "projects/zhuang-zhou-meng-die/project.json",
    "storyboard": "projects/zhuang-zhou-meng-die/storyboard.json",
    "prompts": "projects/zhuang-zhou-meng-die/prompts.json",
    "review": "projects/zhuang-zhou-meng-die/review.md",
    "validationReport": "dist/zhuang-zhou-meng-die/validation-report.json",
    "preview": "dist/zhuang-zhou-meng-die/preview.mp4",
    "final": "dist/zhuang-zhou-meng-die/final.mp4",
    "report": "dist/zhuang-zhou-meng-die/report.json",
    "contactSheet": "dist/zhuang-zhou-meng-die/contact-sheet.jpg",
    "styleProof": "dist/zhuang-zhou-meng-die/style-motion-proof.json"
  },
  "history": [
    {
      "at": "2026-07-22T12:14:43.322Z",
      "action": "project-created",
      "stage": "capability-review",
      "note": ""
    },
    {
      "at": "2026-07-22T12:23:42.244Z",
      "action": "capabilities-ready",
      "stage": "brief",
      "note": "用户明确批准《庄周梦蝶》现有事实口径、五幕故事板与内容推导的 75 秒时长；选择 balanced 制作档位，授权当前 Codex host model 编写文本、当前 Codex 图像生成工具制作图片，并选择 Doubao seed-tts-2.0 的虚构音色‘儒雅逸辰（ruyayichen）’制作中文旁白。"
    },
    {
      "at": "2026-07-22T12:23:42.244Z",
      "action": "brief-ready",
      "stage": "concept-review",
      "note": ""
    },
    {
      "at": "2026-07-22T12:23:42.244Z",
      "action": "approve-concept",
      "stage": "style-review",
      "note": "用户明确批准《庄周梦蝶》现有事实口径、五幕故事板与内容推导的 75 秒时长；选择 balanced 制作档位，授权当前 Codex host model 编写文本、当前 Codex 图像生成工具制作图片，并选择 Doubao seed-tts-2.0 的虚构音色‘儒雅逸辰（ruyayichen）’制作中文旁白。"
    },
    {
      "at": "2026-07-22T13:21:18.133Z",
      "action": "approve-style-voice",
      "stage": "asset-production",
      "note": "用户明确确认修订版通过：传统宣纸蝴蝶风格、四态一次性扇翅后稳定悬停、圆环仅淡入不缩放，以及儒雅逸辰音色均获批准。"
    },
    {
      "at": "2026-07-22T15:26:22.931Z",
      "action": "assets-ready",
      "stage": "preview",
      "note": ""
    },
    {
      "at": "2026-07-22T15:31:27.948Z",
      "action": "preview-rendered",
      "stage": "human-review",
      "note": "dist/zhuang-zhou-meng-die/preview.mp4"
    },
    {
      "at": "2026-07-22T15:50:41.078Z",
      "action": "request-preview-revision",
      "stage": "asset-production",
      "note": "用户要求修正第一幕人物顶层、第二三五幕蝴蝶逐帧循环与落花定格、第三幕蝴蝶顶层、第五幕文字即现和圆环呼吸、以及五幕左上角幕名可读性。"
    },
    {
      "at": "2026-07-22T16:10:11.176Z",
      "action": "assets-ready",
      "stage": "preview",
      "note": ""
    },
    {
      "at": "2026-07-22T16:14:42.555Z",
      "action": "preview-rendered",
      "stage": "human-review",
      "note": "dist/zhuang-zhou-meng-die/preview.mp4"
    },
    {
      "at": "2026-07-22T16:19:25.359Z",
      "action": "approve-preview",
      "stage": "final-render",
      "note": "用户明确回复“样片通过”，批准当前修订样片进入最终本地成片渲染；不包含上传、分享或外部发布授权。"
    },
    {
      "at": "2026-07-22T16:22:56.100Z",
      "action": "final-rendered",
      "stage": "complete",
      "note": "dist/zhuang-zhou-meng-die/final.mp4"
    }
  ]
}
